フォトコン名,開始日,終了日,参加方法,主催者,元ポストのURL
Vketレーシングサポーター フォトコンテスト,2025-10-10,2025-10-19,"レースクイーンやピットクルーなどの改変アバターを撮影し、#VketFormulaPhoto をつけてXに投稿。採用された作品はVket会場でパネル設置。",VirtualMarket バーチャルマーケット Vket (@Virtual_Market_),https://x.com/Virtual_Market_/status/1976573429596954801
第1回 メガネしなの集会 目の愛護デー杯 フォトコン,2025-10-10,2025-11-16,"テーマ「メガネしなの」でメガネしなのちゃんの写真を撮影し、#メガしなフォトコン をつけてXにツイート。入賞者1名にネームロゴ制作。",〜メガネしなの集会〜 (@megane_shinano),https://x.com/megane_shinano/status/1976605549690294300
Mon Fleur PhotoContest,2025-10-10,2025-11-30,"「Mon Fleur」を着用してペア写真を撮影し、#MonFleur_PhotoContest をつけてXに投稿。テーマ「色あせない恋ごころ。おそろいで、ずっときれい。」最優秀賞1組に次回新作衣装ペアセットGIFT + フルイラスト1枚GIFT、優秀賞4組に次回新作衣装1着GIFT。",R&Coco. (@R_and_Coco),https://x.com/R_and_Coco/status/1976580968007053518
ミルフィちゃんフォトコン,2025-10-03,N/A,"ミルフィちゃんのデフォルトアバター限定で写真を撮影し、指定のハッシュタグで投稿。サンプルアバターも参加可能、賞品でミルフィちゃんプレゼント。",ゑゑみゐる (@Emiru_VR),https://x.com/Emiru_VR/status/1974112564150972901
VR PHOTO COMPETITION 2025,2025-10下旬予定,N/A,"詳細は随時更新、入賞・入選作品は富士フイルムフォトサロン 東京 スペース3にてお披露目、HoP in Metaverse クラシックギャラリーでも展示。",Fujifilm House of Photography in Metaverse (@fujifilmjp_hop),https://x.com/fujifilmjp_hop/status/1977705879857414500
おはツイフォトコン (おはコン),N/A,2025-10-15,"#おはコン でおはツイ写真を投稿。",おる@VRC (@oluVRC2ndG),https://x.com/oluVRC2ndG/status/1976052484834525385